{
  "requestId": "req-invoke-0002",
  "op": "invoke",
  "meta": {},
  "payload": {
    "address": "10.74.194.40:12200",
    "service": "com.example.UserService",
    "method": "getUser",
    "argTypes": ["com.example.GetUserRequest"],
    "args": [
      {
        "userId": 123
      }
    ],
    "assertions": [
      {"path": "$.status", "equals": "ACTIVE"},
      {"path": "$.name", "exists": true}
    ],
    "rpcTimeoutMs": 5000
  }
}
