{
  "requestId": "req-invoke-0001",
  "op": "invoke",
  "meta": {
    "traceId": "trace-invoke-0001"
  },
  "payload": {
    "address": "10.74.194.40:12200",
    "service": "com.example.UserService",
    "method": "getUser",
    "argTypes": ["com.example.GetUserRequest"],
    "args": [
      {
        "userId": 123
      }
    ],
    "rpcTimeoutMs": 5000
  }
}
